<?xml version="1.0" encoding="UTF-8"?>
<!DOCTYPE scxml SYSTEM "../../StateMachine_SCXML.dtd">
<!--
Automatically generated by Xholon version 0.5, using Xholon2Scxml.java
Sun Feb 18 19:46:45 EST 2007
www.primordion.com/Xholon
-->
<scxml xmlns="http://www.w3.org/2005/07/scxml" version="1.0" initialstate="Top">
	<notes>
		<body xmlns="http://www.w3.org/1999/xhtml">
			<p>This SCXML file has been generated by an early version of the Xholon SCXML
				exporter. </p>
		</body>
	</notes>
	
	<!-- States -->
	<state id="Top">
		<initial>
			<transition target="StateA1"/>
		</initial>
		<state id="StateA">
			<state id="StateA1">
				<transition event="200" target=":pseudostateChoice_57"/>
				<transition event="100" target="StateA2"/>
				<transition event="100" target="StateA3"/>
			</state>
			<choice id=":pseudostateChoice_57">
				<transition cond="001" target="StateA1"/>
				<transition cond="002" target="StateB"/>
			</choice>
			<state id="StateA2">
			</state>
			<state id="StateA3">
				<transition event="100" target=":pseudostateTerminate_58"/>
				<transition event="300" target="StateB"/>
			</state>
		</state>
		<state id="StateB">
			<transition event="300" target="StateA1"/>
			<transition event="200" target=":finalState_61"/>
			<transition event="100" target="StateA1"/>
		</state>
		<final id=":finalState_61"/>
		<final id=":pseudostateTerminate_58"/>
	</state>
</scxml>
